id,Title,Description,Category
61, Levi's Men's 512 Slim Taper Fit Jeans (Dark Blue),Achieve a modern and stylish look with these slim taper fit jeans from Levi's. Crafted from premium quality denim fabric these jeans offer a comfortable fit and superior durability. The dark blue wash and slim taper silhouette create a contemporary aesthetic that's perfect for any occasion. Whether you're going out with friends or heading to a casual event these jeans elevate your outfit with effortless cool.,Men wear
62, Timex Analog Blue Dial Men's Watch (TW00ZR257E),Add a touch of sophistication to your ensemble with this classic analog watch from Timex. The blue dial with silver-toned hands and markers exudes timeless elegance while the stainless steel bracelet ensures durability and style. Water-resistant up to 30 meters this watch is suitable for everyday wear. Whether you're heading to the office or attending a special event this watch completes your look with refinement.,Watch
63, Puma Unisex Leadcat Slide Sandals (Black),Slide into style with these Leadcat slide sandals from Puma. The black color and bold branding add a sporty vibe to your casual look while the cushioned footbed provides all-day comfort. Whether you're lounging by the pool or hanging out with friends these sandals ensure you stay cool and stylish all day long.,Slipper
64, Adidas Unisex Duramo Slides (Navy Blue),Experience ultimate comfort with these Duramo slides from Adidas. The navy blue color and iconic branding add a sporty touch to your casual ensemble while the contoured footbed provides support and cushioning with every step. Whether you're hitting the gym or relaxing at home these slides offer both style and comfort.,Slipper
65, Google Pixel 6 (Sorta Sunny 8GB RAM 256GB Storage),Stay connected and productive with the Google Pixel 6 smartphone. Powered by the Google Tensor processor this device offers fast and responsive performance for all your tasks. The 6.4-inch FHD+ OLED display provides vibrant visuals while the 4614mAh battery keeps you going all day long. Capture stunning photos with the dual-camera system and enjoy the seamless Android experience with regular updates and security features.,Mobile
66, Motorola Moto G200 5G (Supernova Blue 8GB RAM 128GB Storage),Experience the power of 5G with the Motorola Moto G200 smartphone. Equipped with the Qualcomm Snapdragon 888 processor this device delivers lightning-fast performance and seamless multitasking. The 6.8-inch FHD+ Max Vision display offers immersive visuals while the 5000mAh battery ensures long-lasting usage. Capture every moment in stunning detail with the 108MP quad-camera setup and stay connected with blazing-fast 5G speeds.,Mobile
67, Asus VivoBook Ultra K15 Core i5 11th Gen 15.6-inch FHD Thin & Light Laptop (8GB/512GB SSD/Windows 11/Office 2019/Integrated Graphics/Gaia Green/1.8 kg),Get ready for productivity and entertainment with the Asus VivoBook Ultra K15 laptop. Powered by the 11th Gen Intel Core i5 processor this device offers responsive performance for multitasking and entertainment. The 15.6-inch FHD display provides crisp visuals while the thin and light design makes it ideal for on-the-go use. Whether you're working or streaming content this laptop ensures a seamless experience.,Laptop
68, Acer Nitro 5 Core i5 11th Gen 15.6-inch FHD Gaming Laptop (8GB/512GB SSD/Windows 10/4GB NVIDIA GTX 1650 Graphics/Phantom Black/2.2 kg),Immerse yourself in the world of gaming with the Acer Nitro 5 gaming laptop. Powered by the 11th Gen Intel Core i5 processor and NVIDIA GTX 1650 graphics this device offers smooth gameplay and stunning visuals. The 15.6-inch FHD display with a 144Hz refresh rate provides fluid motion and crisp details while the dual-fan cooling system ensures optimal performance during intense gaming sessions. With a sleek design and powerful specs this laptop takes your gaming experience to the next level.,Laptop
69, Maui Jim Ho'okipa Polarized Rectangular Sunglasses (B407-11|407-11|64|Neutral Grey),Stay cool and protected with these polarized sunglasses from Maui Jim. The neutral grey lenses and rectangular frame design add a modern touch to your look while the polarized lenses reduce glare and enhance visual clarity. Whether you're lounging on the beach or exploring the outdoors these sunglasses offer both style and performance.,Spectacles
70, Ray-Ban Justin Classic Unisex Sunglasses (RB4165|622/6G|55|Grey Gradient),Make a style statement with the Ray-Ban Justin sunglasses. Featuring a classic design and grey gradient lenses these sunglasses exude effortless cool and sophistication. The sturdy frame and iconic branding ensure durability and style making them a timeless addition to your eyewear collection. Whether you're hitting the streets or lounging by the pool these sunglasses elevate your look with urban flair.,Spectacles
